Sinopsis,Hasil Ringkasan Mesin,Hasil Ringkasan Manusia,Hasil ringkasan Web
"On 13 October 2012, a Boeing 737-300 aircraft was being operated by Sriwijaya Air 
conducted a scheduled passenger flight from Polonia International Airport, Medan (WIMM) 
to Minangkabau International Airport (WIPT), Padang. 
The aircraft departed Polonia International Airport with flight number SJY 021, on board the 
aircraft were 102 persons consisted of two pilots, four flight attendants and 96 passengers. 
The Pilot in Command (PIC) acted as Pilot Flying (PF) and the Second in Command (SIC) 
acted as Pilot Monitoring (PM). The flight was the first flight on that day.
The flight from departure until commencing for approach was un-eventful and mostly was on 
Instrument Meteorological Condition (IMC). 
Considering to the cloud condition, the pilot requested runway 33 for the Instrument Landing 
System (ILS) approach and it was approved by the Minang Approach. On descend the pilots 
conducted approach briefing for ILS approach runway 33 according to the Instrument 
Approach Procedure (IAP) chart. The pilots stated that the information contained in the 
approach chart of â€œTabbing (can be mistaken for Minangkabau Intl)â€ was absent during the 
briefing.
When the flight had established to the localizer, the PIC saw a runway at approximately 10Â° 
on the right, the pilot then reported to Minang Approach that the runway was in sight and was 
instructed to contact Minangkabau Tower controller. The pilot intended to make a visual 
approach and disconnected the autopilot then flew manually toward that runway. When 
conducting the visual approach, the pilot assumed that the localizer was incorrect as the 
runway was on the right side. The pilot continued the approach with landing gear down and 
flap 40. The PIC also realized that the rate of descent was about 1,700 feet per minute.
After landing, the pilot reported to Minang tower that they had landed at Tabing Airfield. The 
passengers were completely disembarked safely.
The investigation concluded the contributing factors to this accident are the unclear 
significant information in the photocopy of the ILS approach chart might have missed by the 
pilot and might reduce the pilot awareness to the adjacent airport with similar runway 
direction and dimension; the previous experience of false VOR might have made the approach 
was continued in an un-stabilized approach condition, and the information of incorrect 
runway was not provided during the abnormal approach as it was not observed.
Following this accident the aircraft operator has issued six safety actions and the airport 
operator has issued two safety actions which considered relevant to improve safety. In 
addition, KNKT issued safety recommendations addressed to aircraft operator, air navigation 
provider and the Directorate General of Civil Aviation.","On 13 October 2012, a Boeing 737-300 aircraft was being operated by Sriwijaya Air conducted a scheduled passenger flight from Polonia International Airport, Medan (WIMM) to Minangkabau International Airport (WIPT), Padang. The investigation concluded the contributing factors to this accident are the unclear significant information in the photocopy of the ILS approach chart might have missed by the pilot and might reduce the pilot awareness to the adjacent airport with similar runway direction and dimension; the previous experience of false VOR might have made the approach was continued in an un-stabilized approach condition, and the information of incorrect runway was not provided during the abnormal approach as it was not observed","On 13 October 2012, a Boeing 737-300 flight from Polonia International Airport to Minangkabau International Airport was crashed. The flight was mainly on Instrument Meteorological Condition (IMC), with the pilot requesting runway 33 for the Instrument Landing System (ILS) approach. The pilots conducted an approach briefing, but the information in the approach chart was absent. The pilot assumed the localizer was incorrect and continued the approach with landing gear down and flap 40. The passengers were safely disembarked. The investigation found that unclear information in the photocopy of the ILS approach chart, previous false VOR experiences, and the lack of information about the incorrect runway contributed to the accident. The aircraft operator issued six safety actions and airport operator two to improve safety.","On 13 October 2012, a Boeing 737-300 flight from Polonia International Airport to Minangkabau International Airport was crashed due to an unclear ILS approach chart. The pilot, who was the Pilot in Command (PIC), was on the first flight on that day. The flight was un-eventful and mostly on Instrument Meteorological Condition (IMC). The pilot requested runway 33 for the ILS approach, which was approved by the Minang Approach. During the descent, the pilots reported the missing information in the IAP chart. The pilot assumed the localizer was incorrect, and continued the approach with landing gear down and flap 40. The passengers were safely disembarked. The investigation concluded that the pilot's unclear information, previous false VOR experiences, and the lack of information about the incorrect runway contributed to the accident. The aircraft operator issued six safety actions, and the airport operator issued two to improve safety. KNKT issued safety recommendations to the aircraft operator, air navigation provider, and the Directorate General of Civil Aviation."
"The investigation could not reach the accident site due to terrain condition, therefore the
investigation utilized photos of the wreckage and other relevant and data, which were taken 
by the search and rescue personnel.
According to the KNKT policy and procedures, investigation report of accident with fatality 
should be in full report format. However, to minimize subheadings without information, this 
investigation reported in short report format.
On 03 October 2012, a Pacific Aerospace LTD, PAC 750 XL aircraft registration PK-RWT 
was being operated by Yayasan Pelayan Penerbangan Tariku Aviation on a flight from 
Koropun to Dekai in Papua area. This flight was the 9
th flight of that day. All flights were 
performed in accordance to the Visual Flight Rules (VFR).
The first flight was from Sentani to Langda which was arrived at 2220 UTC (0720 LT). The 
last contact of the pilot was â€œthe aircraft on the ground Koropunâ€ at 0120 UTC as reported by 
the pilot through the company flight following system. The aircraft then departed Koropun to 
Dekai and lost contact during this flight. On board in this flight were one pilot and one 
passenger. 
The aircraft was found on 5 October 2012, in mountainous area with approximate elevation of 
7,000 feet, at coordinate 04ï‚°52â€™S; 139ï‚°29â€™E. Both crew and passenger on board were fatally 
injured.
The pilot held valid license and medical certificate. All mandatory trainings and checks have 
been performed. The duty and rest period for the pilot were in accordance with the current 
Indonesia regulations. 
There was no damage or any system problem reported and the aircraft was airworthy prior to 
the departure.
This aircraft was not required to be equipped with any recorders according to the current 
Indonesia regulations. 
The examination to the aircraft wreckage indicated that this accident was classified as 
Controlled Flight into Terrain (CFIT) where an aircraft, under control of the pilot, 
unintentionally impact to terrain. The CFIT accident commonly occurred when pilot vision to 
the terrain is blocked or in low visibility.
The investigation concluded the contributing factors as follows: The accident was classified 
as Controlled Flight into Terrain (CFIT) which most likely occurred in low visibility 
classified as IMC (Instrument Meteorology Condition) while the flight should be performed 
in Visual Flight Rules (VFR).
Prior to issuing this final report, the KNKT has not been informed several safety actions taken 
by PT. Yayasan Pelayan Penerbangan Tariku Aviation.
Included in this final report, the KNKT has issued several safety recommendations to the PT. 
Yayasan Pelayan Penerbangan Tariku Aviation, and Directorate General of Civil to address 
the safety issues identified on chapter 5 (five) in this report.","On 03 October 2012, a Pacific Aerospace LTD, PAC 750 XL aircraft registration PK-RWT was being operated by Yayasan Pelayan Penerbangan Tariku Aviation on a flight from Koropun to Dekai in Papua area. The investigation concluded the contributing factors as follows: The accident was classified as Controlled Flight into Terrain (CFIT) which most likely occurred in low visibility classified as IMC (Instrument Meteorology Condition) while the flight should be performed in Visual Flight Rules (VFR)","The investigation into a fatal accident involving a Pacific Aerospace LTD, PAC 750 XL aircraft was conducted in a mountainous area in Papua, Indonesia. The aircraft was operated by Yayasan Pelayan Penerbangan Tariku Aviation, with the pilot and passenger on board. The accident was classified as Controlled Flight into Terrain (CFIT), where the pilot's vision to the terrain was blocked or in low visibility. The investigation concluded that the accident likely occurred in low visibility and should have been performed in Visual Flight Rules (VFR). The KNKT has issued several safety recommendations to the aviation company and the Directorate General of Civil to address the safety issues identified in the report.","The investigation into a fatal accident involving a Pacific Aerospace LTD, PAC 750 XL aircraft on October 3, 2012, was conducted in a mountainous area. The aircraft was operated by Yayasan Pelayan Penerbangan Tariku Aviation and was on its 9th flight. The pilot had a valid license and medical certificate, and all mandatory trainings and checks were performed. The aircraft was found in a low visibility area, classified as IMC (Instrument Meteorology Condition), and should have been performed in Visual Flight Rules (VFR). The KNKT has issued safety recommendations to PT. Yayasan Pelayan Penerbangan Tariku Aviation and the Directorate General of Civil to address the safety issues identified in chapter 5."
"On 12 September 2012 a thrush T34, registration PK â€“ PNO operated by PT. Sinar Mas 
Super Air for an agriculture operation departed from Ujung tanjung Airstrip to Nagamas 
Airstrip the aircraft airborne at 0005 UTC (0705 LT) the weather information on 
destination was a bit haze. 
During flight to Nagamas Airstrip the weather was low cloud along the route. When the 
aircraft overhead Nagamas Airstrip, the runway was not in sight then the pilot decided to 
return to Ujung Tanjung Airstrip. Upon overhead Ujung Tanjung Airstrip the Pilot 
observed wind condition from the wind shock approximately 7 knots up to 10 knots from 
the South East, and He also observed there were motorcycles moving on the runway edge. 
As such condition categorized as normal operation he decided to land. 
During landing the aircraft experiences a hard landing and bounced, thereafter during 
rolling the aircraft veered off to the left and stopped on the ditch at approximately 21 
meters left of the runway edge beneath the palm trees with the tail upside. 
The right landing gear was sifted up and rearward, the propeller blades bent rearward and 
the outer upper right wing was heavy dent. 
The pilot certified and qualified according to Indonesia current regulation. 
The aircraft were certified and airworthy according to Indonesia current regulation. 
The runway surface of Ujung Tanjung airstrip was grass and slippery when wet, at about 
half of the runway there was a free access crossing road had a joggle that more than five 
centimeters, there was also free access road along the runway edge. 
The investigation could not find the hazard identification and risk assessment that 
mandated in the Sinar Mas Super Air AOM. There was no person injured in this 
occurrence. 
At about a half of the runway there was an access crossing road that had the grass missed 
and slippery when wet. 
The aircraft had experienced hard landing and veered to the left hit the ditch, the right main 
landing gear was collapsed, the propeller blades was bent and the engine flange C was 
wrinkle. 
The investigation concluded the contributing factors as follows: 
â€¢ The pilot departed without proper weather information and it sources, the weather en route was low cloud. 
â€¢ The pilot workload was increase due to fly in marginal weather combined with 
potential hazard near the runway. 
v 
At the time of issuing this final investigation report, the National Transportation Safety 
Committee had not been informed of any safety actions resulting from this occurrence. 
According to factual information, findings and the contributing factors in this final report, 
the NTSC has issued several safety recommendations to the PT. Sinar Mas, Directorate 
General of Civil Aviation, to address the safety issues identified in this final report. ","Sinar Mas Super Air for an agriculture operation departed from Ujung tanjung Airstrip to Nagamas Airstrip the aircraft airborne at 0005 UTC (0705 LT) the weather information on destination was a bit haze. During landing the aircraft experiences a hard landing and bounced, thereafter during rolling the aircraft veered off to the left and stopped on the ditch at approximately 21 meters left of the runway edge beneath the palm trees with the tail upside","On 12 September 2012, a thrush T34 aircraft operated by PT. Sinar Mas Super Air departed from Ujung Tanjung Airstrip to Nagamas Airstrip. The weather was haze, low cloud, and windy. The pilot decided to land at Ujung Tanjung Airstrip, where the aircraft experienced a hard landing and bounced. The pilot veered off to the left and stopped on a ditch. The investigation found no hazard identification and risk assessment mandated by the Sinar Mas Super Air AOM. The investigation concluded that the pilot departed without proper weather information, the low cloud en route, and increased workload due to marginal weather and potential hazards near the runway. The National Transportation Safety Committee was not informed of any safety actions resulting from the incident.","On 12 September 2012, a thrush T34 operated by PT. Sinar Mas Super Air departed from Ujung Tanjung Airstrip to Nagamas Airstrip. The weather was haze, low cloud, and the pilot departed without proper weather information. The aircraft was flying at low cloud and a wind condition, with motorcycles moving on the runway edge. During landing, the aircraft experienced a hard landing, bounced, and veered off to the left. The right landing gear was sifted up, the propeller blades bent, and the outer upper right wing had a heavy dent. The investigation found no hazard identification and risk assessment required in the Sinar Mas Super Air AOM. The pilot's workload increased due to marginal weather and potential hazards near the runway. The National Transportation Safety Committee was not informed of any safety actions resulting from the incident. The NTSC issued several safety recommendations to PT. Sinar Mas, Directorate General of Civil Aviation, to address the safety issues identified in the report."
"On 24 August 2012, a Piper Chieftain PA-31-350 aircraft, registered PK-IWH, was being 
operated by PT. Intan Angkasa Airservice to conduct an aerial survey (aero magnetic) flight at 
a survey area located north of Bontang, East Kalimantan. 
There were 4 persons on board; one pilot, one security officer and two surveyors. The flight 
was planned with an altitude of 3,000 feet AMSL en-route and 500 feet AGL while surveying 
the area. The fuel endurance was for 6 hours flight time. 
The aircraft departed from Temindung Airport (WALS), Samarinda at 0751 local time (LT - 
2351 UTC). 
At 0004 UTC, the pilot informed to the Temindung Control Tower controller (Temindung 
Tower) that the aircraft was abeam Tanjung Santan descending from 3,000 feet and 
established contact with Bontang Info officer (Bontang Info). 
At 0005 UTC, the pilot informed the Bontang Info that their altitude was 300 feet and 
estimated over Bontang at 0011 UTC. Bontang info acknowledged this transmission and 
advised the pilot to report when the flight left the Bontang Area. 
At 0010 UTC, the SureTrack (flight following system) stopped receiving data from the 
aircraft. The last recorded information was an aircraft speed of 138 knots, heading 352Â°, 
latitude 0Â°8â€™33â€ N and longitude 117Â°12â€™54â€ E. 
At 0600 UTC, the engineer of the PK-IWH aircraft asked the Temindung Tower about the 
flight as the fuel endurance had been exceeded. 
The Temindung Tower contacted Bontang Info to get information about the aircraft. After 
receiving the request, Bontang Info tried to contact the pilot twice and there was no reply. 
Bontang Info also contacted the Tanjung Bara Airstrip to request information about the 
aircraft but there was no information. 
At 0730 UTC, the search and rescue team assembled, the team consisted of the Temindung 
Airport Authority, National Search and Rescue, Indonesian Police, Army and Airforce. The 
search operation was conducted via ground and air using three helicopters. 
On 26 August 2012 at 0850 UTC, the aircraft wreckage was located by a ground search team 
on a ridge of Mayang Hill, Bontang at approximately 1,200 feet AMSL at coordinates 
00Â°12â€™34.3â€N, 117Â°16â€™57.3â€E, 12 NM from Bontang Aerodrome on bearing of 294Â°. The 
accident site was within the planned aircraft survey area. 
All occupants were fatally injured and the aircraft was destroyed by impact force and post 
impact fire. 
The investigation found several findings and concluded that this accident is typical of a 
Controlled Flight Into Terrain (CFIT). Low altitude flying in a low visibility environment 
limited the pilotâ€™s sight and increases the probability impact to the terrain. 
Following this investigation PT. Intan Angkasa Airservice have performed several safety 
actions. The NTSC issued several safety recommendations to the Indonesia Directorate 
General of Civil Aviation (DGCA) and PT. Intan Angkasa Airservice. ","At 0004 UTC, the pilot informed to the Temindung Control Tower controller (Temindung Tower) that the aircraft was abeam Tanjung Santan descending from 3,000 feet and established contact with Bontang Info officer (Bontang Info). On 26 August 2012 at 0850 UTC, the aircraft wreckage was located by a ground search team on a ridge of Mayang Hill, Bontang at approximately 1,200 feet AMSL at coordinates 00Â°12â€™34","On 24 August 2012, a Piper Chieftain PA-31-350 aircraft, registered PK-IWH, was operated by PT. Intan Angkasa Airservice for an aerial survey. The flight was planned with an altitude of 3,000 feet AMSL and 500 feet AGL. The pilot reported the aircraft's altitude to the Temindung Control Tower controller and Bontang Info officer. The SureTrack system stopped receiving data from the aircraft, and the flight was deemed overdue. The search and rescue team assembled, including the Temindung Airport Authority, National Search and Rescue, Indonesian Police, Army, and Airforce. The aircraft was found to be destroyed by impact force and post-impact fire, with all occupants fatally injured. The investigation concluded that the accident was typical of a Controlled Flight Into Terrain (CFIT).","On 24 August 2012, a Piper Chieftain PA-31-350 aircraft, registered PK-IWH, was operating an aerial survey flight north of Bontang, East Kalimantan. The flight had an altitude of 3,000 feet AMSL and 500 feet AGL. The pilot reported the aircraft's altitude to the Temindung Control Tower, but the SureTrack system stopped receiving data. The Temindung Tower contacted Bontang Info, but no information was received. A search and rescue team was assembled, and the aircraft was found on a ridge of Mayang Hill, Bontang. All occupants were fatally injured, and the aircraft was destroyed by impact force and post-impact fire. The investigation concluded that the accident was typical of a Controlled Flight Into Terrain (CFIT), with low altitude flying in low visibility limiting pilot visibility and increasing the likelihood of impacting the terrain. PT. Intan Angkasa Airservice has taken several safety actions and issued safety recommendations to the Indonesia Directorate General of Civil Aviation (DGCA) and PT"
"On 5 Agustus 2012, a Cessna 172 aircraft registration PK-ROI operated by PT Bali 
International Flight Academy (BIFA) was performing mutual flight training on a cross 
country flight which from Letnan Kolonel Wisnu Airport - Blimbingsari Airport and return 
to Letnan Kolonel Wisnu Airport. 
At 05.50 UTC the aircraft departed Blimbingsari Airport to Letnan Kolonel Wisnu Airport. At 
Labuan point, the aircraft descend to 1000 feet to join right downwind runway 32. 
At altitude 500 feet the aircraft was at configuration of flap 30, airspeed 65 knot and reduce to 
60 knot on short final. The pilot reduced power to idle. Afterward the pilot felt the aircraft 
sank and impacted to the tree. The pilot attempted to go around and opened the power. The 
aircraft veered to the left and impacted to the ground. 
The first impact mark was found on the top of a tree on short final runway 32 with 
approximate height of 10 meters. Prior to rest at last position, two impact marks found on the 
airport fence and a tree. The aircraft stopped on the left runway 32 about 59 meter from centre 
line of runway. 
The occupants suffered minor injuries. The aircraft substantially damage. There was minor 
damage to a house. 
Both pilots held valid license and medical certificate, and have flight experienced 
approximately 91 flying hours on type. 
The aircraft was airworthy prior to impact. 
The pilot started to put the engine power to idle while on position abeam Honda store was 
accordance to his perception of correct approach procedure. Refer to the fact of the first 
impact position and the sink after power reduction was highly possible that the aircraft speed 
was relatively low on short final. 
The NTSC issued several safety recommendations to address safety issues identified during 
the investigation.","On 5 Agustus 2012, a Cessna 172 aircraft registration PK-ROI operated by PT Bali International Flight Academy (BIFA) was performing mutual flight training on a cross country flight which from Letnan Kolonel Wisnu Airport - Blimbingsari Airport and return to Letnan Kolonel Wisnu Airport. Refer to the fact of the first impact position and the sink after power reduction was highly possible that the aircraft speed was relatively low on short final","On 5 Agustus 2012, a Cessna 172 aircraft, operated by PT Bali International Flight Academy, crashed during a cross-country flight from Letnan Kolonel Wisnu Airport to Blimbingsari Airport. The pilot reduced power to idle and felt the aircraft sink, causing it to veer to the left and impact to the ground. The occupants suffered minor injuries, and the aircraft sustained substantial damage. Both pilots had valid licenses and medical certificates, and the aircraft was airworthy before the incident. The NTSC issued safety recommendations to address the incident.","On 5 Agustus 2012, a Cessna 172 aircraft, operated by PT Bali International Flight Academy, experienced a crash during a cross-country flight from Letnan Kolonel Wisnu Airport to Blimbingsari Airport. The pilot, who had experienced 91 flying hours on type, lowered the engine power to idle while on position abeam Honda store, which may have caused the aircraft's speed to be relatively low on short final. The occupants suffered minor injuries, and the aircraft sustained substantial damage, with minor damage to a house. The NTSC issued safety recommendations to address the investigation."
