Sinopsis,Hasil Ringkasan Mesin,Hasil Ringkasan Manusia,Hasil ringkasan Web
" On 18 December 2020, a Cessna 172 aircraft, registered PK-TGW, was being operated 
by Global Aviation Flying School on circuit local flight training at Budiarto Airport 
(WIRR), Curug, Tangerang1
. On board of the aircraft was one instructor and one 
student pilot. The flight was planned for first solo check flight.
The aircraft was not equipped with any flight recorder and the radio communication 
was not recorded therefore, the investigation was based on the data collected on the 
occurrence site and the interview with the instructor and the student pilot.
About 0030 UTC2
(0730 LT), the student pilot attended morning briefing by the 
instructor, prior to perform first solo check at Global Flying School flight operation 
office.
About 0800 LT, the student pilot and the instructor performed check flight for first 
solo and conducted 4 touch and go exercises. After completed the first solo check 
flight, the instructor released the student pilot for first solo flight. The instructor 
instructed the student to conduct one circuit only for the first solo flight. 
About 0920 LT, the student pilot requested start up clearance to the Budiarto Ground 
Controller for first solo circuit flight.
After the engine started, the student pilot requested taxi clearance. About 0933 LT, 
PK-TWG took off from Runway 30.
At 0939 LT, the Budiarto Tower Controller issued clearance for touch and go to the 
student pilot. PK-TGW conducted touch and go. 
At 0943 LT, the student pilot reported to Budiarto Tower Controller that the position 
was on downwind.
At 0946 LT, the student pilot reported position was on final and the Budiarto Tower 
Controller issued the landing clearance and informed that the wind was calm.
The student pilot felt that the approach was normal and uneventful. After touchdown 
the student pilot found that the aircraft tend to turn to the left and was hard to control 
to maintain the runway centerline. The aircraft continued move to the left and stopped 
on a ditch on the left of the runway 30, approximately 80 meters from runway 
centerline and 435 meters from beginning of runway.
No one injured in this occurrence. "," On 18 December 2020, a Cessna 172 aircraft, registered PK-TGW, was being operated by Global Aviation Flying School on circuit local flight training at Budiarto Airport (WIRR), Curug, Tangerang1. About 0030 UTC2(0730 LT), the student pilot attended morning briefing by the instructor, prior to perform first solo check at Global Flying School flight operation office","On 18 December 2020, a Cessna 172 aircraft, registered PK-TGW, was operated by Global Aviation Flying School at Budiarto Airport. The aircraft was not equipped with a flight recorder or radio communication, leading to an investigation. The student pilot reported the aircraft's position to be on downwind and landing on a ditch, but no one was injured. The incident highlights the importance of proper flight recorder and communication during training.","On December 18, 2020, a Cessna 172 aircraft, registered PK-TGW, was operating at Budiarto Airport for local flight training. The aircraft was unequipped with a flight recorder and radio communication. The investigation involved data collected from the occurrence site and interviews with the instructor and student pilot. The student pilot reported the aircraft's position to be on downwind, but it turned to the left and stopped on a ditch. No one was injured in the incident."
"On 20 April 2020, a Pacific Aerospace FU 24-950 (Fletcher) aircraft, with registration PKPNZ operated by PT Sinar Mas Super Air as agriculture (fertilizer spraying) flight in Mabruk Airstrip, Lereh, Papua. The pilot conducted 15 fertilizer spraying flights, with estimated flight time of 10 minutes for each flight. The west side area of Mambruk airstrip was an area dedicated as conservation and some local people utilized the conservation area on the left side of threshold runway 36 as livestock boar farming. The dead boar has been confirmed to be owned by local people whose farming on conservation area on the left side of runway 36. No one injured on this occurrence and the aircraft had minor damage. The investigation concluded the contributing factor of the occurrence was that the aircraft nose wheel collapsed after impacted a boar that was on the airstrip. The fence and gutter condition allowed the boar to cross and entered the airstrip. During the investigation, the Komite Nasional Keselamatan Transportasi (KNKT) has been informed several safety actions taken by aircraft operator and airstrip operator. The KNKT acknowledged the safety actions taken and considered relevant to improve the safety issues identified in this investigation. Therefore, the KNKT is not issuing safety recommendations in this report.
","On 20 April 2020, a Pacific Aerospace FU 24-950 (Fletcher) aircraft, with registration PKPNZ operated by PT Sinar Mas Super Air as agriculture (fertilizer spraying) flight in Mabruk Airstrip, Lereh, Papua. During the investigation, the Komite Nasional Keselamatan Transportasi (KNKT) has been informed several safety actions taken by aircraft operator and airstrip operator","A Pacific Aerospace FU 24-950 aircraft crashed in Mabruk Airstrip, Lereh, Papua, killing a boar owned by locals. The pilot conducted 15 fertilizer spraying flights, with the aircraft's nose wheel collapsing after impacting the boar. The Komite Nasional Keselamatan Transportasi (KNKT) was informed of the safety actions taken by the aircraft and airstrip operator, but did not issue safety recommendations in this report.","On April 20, 2020, a Pacific Aerospace FU 24-950 aircraft operated by PT Sinar Mas Super Air conducted 15 fertilizer spraying flights in Mabruk Airstrip, Lereh, Papua. The aircraft's nose wheel collapsed after impacting a boar on the airstrip, which was owned by local people. The investigation concluded that the boar was owned by local people. The Komite Nasional Keselamatan Transportasi (KNKT) acknowledged the safety actions taken by the aircraft and airstrip operator, but did not issue safety recommendations in this report."
"On 22 July 2019, a Cessna 172S registered PK-WUG was being operated by Angkasa
Aviation Academy (AAA) on a mutual flight training exercise from Cakrabhuwana Airport 
(WICD), Cirebon to Indramayu Training Area. The flight plan was filed with cruising altitude 
of 2,000 feet. The exercise for the student pilot was on C-14 Stage which contained exercises 
of mutual precision rate one turns, compass error and performance maneuvers.
Prior to the departure, there was no record or report of aircraft system malfunction. On board 
the aircraft were two student pilots and one of the students acted as Pilot in Command (PIC)
while the other student pilot seated on the right seat. 
At 1358 LT, the PK-WUG aircraft departed from Cirebon to the Indramayu Training Area. 
The Global Positioning System (GPS) installed in the aircraft recorded that when the aircraft 
was flying over the southern boundary of the Indramayu Training Area, the aircraft was 
descending. At 1425 LT, the aircraft flew westerly and was descending passed 750 feet.
The aircraft continued descend and while flew over the Cimanuk River passed 140 feet. 
About one minute flying over the river, the aircraft struck power line cables and crashed into
the river.
After the aircraft stopped, both pilots self-evacuated from the aircraft and helped by local 
people to the river bank. During the evacuation, the Safety Pilot was drowned and fatally 
injured while the PIC had minor injury. 
The investigation determined that the aircraft serviceability was not issue in this accident. The 
investigation concluded the contributing factor of the accident was: 
The available means to monitor flight training activities that had not been utilized 
resulted in the aircraft flying below the minimum safe altitude was undetected.
Flying the aircraft below the minimum safe altitude and unaware of the power line cables 
ran across the river made the aircraft struck three power line cables.
The KNKT had been informed safety actions taken by the AAA and considered relevant to 
improve safety, however there still safety issues remain to be considered. Therefore, the 
KNKT issued safety recommendations to the AAA and Directorate General of Civil Aviation 
to address safety issues identified in this report
","On 22 July 2019, a Cessna 172S registered PK-WUG was being operated by AngkasaAviation Academy (AAA) on a mutual flight training exercise from Cakrabhuwana Airport (WICD), Cirebon to Indramayu Training Area. The investigation concluded the contributing factor of the accident was: The available means to monitor flight training activities that had not been utilized resulted in the aircraft flying below the minimum safe altitude was undetected","On 22 July 2019, a Cessna 172S registered PK-WUG was operating a mutual flight training exercise from Cakrabhuwana Airport to Indramayu Training Area. The flight plan was filed with a cruising altitude of 2,000 feet. The aircraft was operated by Angkasa Aviation Academy (AAA) and had two student pilots. At 1358 LT, the aircraft was descending and over the Cimanuk River. The aircraft struck power line cables and crashed into the river. The Safety Pilot was drowned and fatally injured, while the PIC had minor injuries. The investigation found that the aircraft serviceability was not an issue, but the lack of available means to monitor flight training activities led to the aircraft flying below the minimum safe altitude. The KNKT issued safety recommendations to the AAA and Directorate General of Civil Aviation to address the safety issues identified in the report.","On 22 July 2019, a Cessna 172S registered PK-WUG was operated by Angkasa Aviation Academy (AAA) on a mutual flight training exercise. The flight plan was filed with a cruising altitude of 2,000 feet. The aircraft was on C-14 Stage, with no record of aircraft system malfunction. The Global Positioning System (GPS) recorded the aircraft's descent and descent over the Cimanuk River. The aircraft struck power line cables and crashed into the river, causing the Safety Pilot to drown and be fatally injured, while the PIC had minor injuries. The KNKT issued safety recommendations to the AAA and Directorate General of Civil Aviation to address the safety issues identified."
"On 25 May 2019, an Airbus A320 aircraft registered PK-LZJ was being operated on a 
scheduled passenger flight from Sultan Hasanuddin International Airport (WAAA), Makassar 
to Mopah International Airport (WAKK), Merauke. On board the aircraft was two pilots, five 
flight attendants and 82 passengers. 
At 1842 UTC (0242 LT), on night time, the aircraft commenced pushback from stand B1. The 
push back operation used towing tractor with the three crews consisted of towing tractor 
driver, a wing-man and a headset-man who performed by an aircraft mechanic. There was no 
briefing among the crew related to the pushback activity including the push back maneuver. 
The towing tractor driver and wing-man used high visibility vest while the headset-man used 
company uniform without any fluorescence strip or high visibility vest. 
The push back maneuver did not follow the guideline and the headset-man walked behind the 
nose wheel while observing the engine start process. During a turn, the aircraft nose wheel 
passed over the right foot of the headset-man. The towing tractor driver felt a bump and 
noticed that the headset-man laid on the ground. The headset-man evacuated to the nearest 
hospital for medical treatment and found sustaining fracture on his right tarsometatarsal.
The investigation determined that the aircraft and towing tractor airworthiness serviceability, 
and communication transmission were not an issue on this occurrence. Therefore, the analysis 
discussed the pushback operation and personnel awareness. The investigation concluded the 
contributing factors of the occurrence as follows:
The different assumption of pushback maneuver between headset-man and the push back 
tractor driver, and both were fixated to their own duties while working on a reduced 
alertness condition, resulted in the towing tractor driver did not aware of the headset-man 
position and the headset-man did not aware of the nose wheel position. These conditions led 
to the nose wheel passed over the headset-man foot.
The KNKT had been informed of safety actions taken by the involved parties resulting from 
this occurrence. However, there still remain safety issues that need to be considered. 
Therefore, the KNKT issues the following safety recommendations addressed to the Angkasa 
Aviasi Servis
","On 25 May 2019, an Airbus A320 aircraft registered PK-LZJ was being operated on a scheduled passenger flight from Sultan Hasanuddin International Airport (WAAA), Makassar to Mopah International Airport (WAKK), Merauke. The investigation concluded the contributing factors of the occurrence as follows:The different assumption of pushback maneuver between headset-man and the push back tractor driver, and both were fixated to their own duties while working on a reduced alertness condition, resulted in the towing tractor driver did not aware of the headset-man position and the headset-man did not aware of the nose wheel position","On 25 May 2019, an Airbus A320 aircraft from Sultan Hasanuddin International Airport to Mopah International Airport crashed during a pushback operation. The aircraft had two pilots, five flight attendants, and 82 passengers. The towing tractor driver, wing-man, and headset-man were not briefed on the pushback maneuver, leading to the nose wheel passing over the headset-man's foot during a turn. The headset-man was injured and subsequently sustaining a fracture on his right tarsometatarsal. The investigation found that the aircraft and towing tractor airworthiness serviceability and communication transmission were not issues. The KNKT has issued safety recommendations to the involved parties.","On May 25, 2019, an Airbus A320 aircraft was operating from Sultan Hasanuddin International Airport to Mopah International Airport. At 1842 UTC, the aircraft began pushback from stand B1 using a towing tractor. The crew, including a towing tractor driver, wing-man, and headset-man, were not briefed on the pushback maneuver. The headset-man, who was wearing a company uniform without a fluorescence strip, walked behind the nose wheel during a turn, causing the aircraft nose wheel to pass over the headset-man's right foot. The investigation found that the aircraft and towing tractor airworthiness serviceability were not issues. The KNKT has been informed of safety actions taken, but there are still safety issues to be considered."
"On 11 August 2018, a PAC 750XL aircraft registered PK-HVQ was being operated by PT. 
Marta Buana Abadi (Dimonim Air) on unscheduled passenger flight from Tanah Merah to 
Oksibil. At the day of the occurrence the meteorological condition at Oksibil was below the 
requirement of Visual Flight Rule (VFR) weather minima and did not improve. Being aware 
that some flights had performed flight to Tanah Merah to Oksibil and returned, the pilot 
decided to fly to Oksibil. 
At 1342 LT, on daylight condition the PK-HVQ aircraft departed from Tanah Merah to 
Oksibil, on board the aircraft were one pilot, one observer pilot and 7 passengers. According 
to the passenger and cargo manifest, the total weight of passenger and the baggage were 473 
kg. Prior to the departure, there was no record or report of aircraft system malfunction.
At 1411 LT, the PK-HVQ pilot made initial contact to Oksibil Tower controller and reported 
that the aircraft was maintaining altitude of 7,000 feet over and the estimate time arrival at 
Oksibil would be 0520 UTC (1420 LT). The Oksibil Tower controller advised the pilot of the 
latest meteorological condition that the visibility was 1 up to 2 km and most of the area were 
covered by cloud.
At 1416 LT, the pilot reported that the aircraft position was over Oksibil Aiport and the 
Oksibil Tower controller instructed the pilot to continue the flight to the final runway 11 and 
to report when the runway had in sight.
The Oksibil Tower controller and pilots of other aircraft called the pilot but no reply. On the 
following day, the aircraft was found on a ridge of mountain about 3.8 Nm north west of 
Oksibil on bearing 331Â° with elevation about 6,800 feet. Eight occupants were fatally injured 
and one occupant was seriously injured. 
Investigation involved Transport Accident Investigation Commission of New Zealand and 
Transportation Safety Board of Canada that assigned accredited representative according to 
the ICAO Annex 13.
The investigation determined the contributing factors of the occurrence as follows:
VFR weather minimum requirement that was not implemented properly most likely had 
made the pilot did not have a clear visual to the surrounding area. 
Considering that the Pilot in Command (PIC) had lack knowledge of the terrain 
surrounding the Oksibil area, and the absence of voice alert from the TAWS when the 
aircraft flying close to terrain, resulted in the PIC did not have adequate awareness to the 
surrounding terrain while flying into clouds and continued to fly below the terrain height 
until the aircraft impacted the terrain.
The KNKT acknowledged the safety action taken by the related parties and considered the 
actions were relevant to improve safety, however, there still remain safety issues that need to 
be considered. Therefore, the KNKT issues safety recommendations addressed to the 
Dimonim Air, Directorate General of Civil Aviation (DGCA), and Badan Meteorologi 
Klimatologi dan Geofisika/Bureau of Meteorology, Climatology and Geophysics (BMKG).
","At 1411 LT, the PK-HVQ pilot made initial contact to Oksibil Tower controller and reported that the aircraft was maintaining altitude of 7,000 feet over and the estimate time arrival at Oksibil would be 0520 UTC (1420 LT). Therefore, the KNKT issues safety recommendations addressed to the Dimonim Air, Directorate General of Civil Aviation (DGCA), and Badan Meteorologi Klimatologi dan Geofisika/Bureau of Meteorology, Climatology and Geophysics (BMKG)","On 11 August 2018, a PAC 750XL aircraft, registered PK-HVQ, was operated by PT. Marta Buana Abadi (Dimonim Air) on an unscheduled passenger flight from Tanah Merah to Oksibil. The meteorological conditions at Oksibil were below the Visual Flight Rule (VFR) weather minima, and the pilot decided to fly to Oksibil. The aircraft had a total weight of 473 kg and had no record of aircraft system malfunction. The pilot reported altitude of 7,000 feet and an estimated arrival time of 0520 UTC. The aircraft was found on a mountain ridge, with eight occupants fatally injured and one seriously injured. The investigation involved the Transport Accident Investigation Commission of New Zealand and the Transportation Safety Board of Canada. The KNKT acknowledged the safety actions taken by related parties but still needs to consider further safety issues.","On 11 August 2018, a PAC 750XL aircraft, registered PK-HVQ, was operating from Tanah Merah to Oksibil. The meteorological condition at Oksibil was below the Visual Flight Rule (VFR) weather minima, and the pilot decided to fly to Oksibil. The aircraft had a total weight of 473 kg and no record of aircraft system malfunction. At 1411 LT, the pilot reported an altitude of 7,000 feet and an estimated arrival time of 0520 UTC (1420 LT). The Oksibil Tower controller advised the pilot to continue the flight to the final runway 11. The aircraft was found on a mountain ridge, with eight occupants fatally injured and one seriously injured. The investigation involved the Transport Accident Investigation Commission of New Zealand and the Transportation Safety Board of Canada, which assigned an accredited representative according to ICAO Annex 13. The investigation determined that the pilot's lack of knowledge of the surrounding terrain and the absence of voice alert from the TAWS caused the pilot to fly below the terrain height until it impacted the terrain. The KNKT acknowledged the safety actions taken by related parties, but there are still safety issues that need to be considered."
"On 25 May 2019, an Airbus A320 aircraft registered PK-LZJ was being operated on a 
scheduled passenger flight from Sultan Hasanuddin International Airport (WAAA), Makassar 
to Mopah International Airport (WAKK), Merauke. On board the aircraft was two pilots, five 
flight attendants and 82 passengers. 
At 1842 UTC (0242 LT), on night time, the aircraft commenced pushback from stand B1. The 
push back operation used towing tractor with the three crews consisted of towing tractor 
driver, a wing-man and a headset-man who performed by an aircraft mechanic. There was no 
briefing among the crew related to the pushback activity including the push back maneuver. 
The towing tractor driver and wing-man used high visibility vest while the headset-man used 
company uniform without any fluorescence strip or high visibility vest. 
The push back maneuver did not follow the guideline and the headset-man walked behind the 
nose wheel while observing the engine start process. During a turn, the aircraft nose wheel 
passed over the right foot of the headset-man. The towing tractor driver felt a bump and 
noticed that the headset-man laid on the ground. The headset-man evacuated to the nearest 
hospital for medical treatment and found sustaining fracture on his right tarsometatarsal.
The investigation determined that the aircraft and towing tractor airworthiness serviceability, 
and communication transmission were not an issue on this occurrence. Therefore, the analysis 
discussed the pushback operation and personnel awareness. The investigation concluded the 
contributing factors of the occurrence as follows:
The different assumption of pushback maneuver between headset-man and the push back 
tractor driver, and both were fixated to their own duties while working on a reduced 
alertness condition, resulted in the towing tractor driver did not aware of the headset-man 
position and the headset-man did not aware of the nose wheel position. These conditions led 
to the nose wheel passed over the headset-man foot.
The KNKT had been informed of safety actions taken by the involved parties resulting from 
this occurrence. However, there still remain safety issues that need to be considered. 
Therefore, the KNKT issues the following safety recommendations addressed to the Angkasa 
Aviasi Servis
","On 25 May 2019, an Airbus A320 aircraft registered PK-LZJ was being operated on a scheduled passenger flight from Sultan Hasanuddin International Airport (WAAA), Makassar to Mopah International Airport (WAKK), Merauke. The investigation concluded the contributing factors of the occurrence as follows:The different assumption of pushback maneuver between headset-man and the push back tractor driver, and both were fixated to their own duties while working on a reduced alertness condition, resulted in the towing tractor driver did not aware of the headset-man position and the headset-man did not aware of the nose wheel position","On 25 May 2019, an Airbus A320 aircraft from Sultan Hasanuddin International Airport to Mopah International Airport crashed during a pushback operation. The aircraft had two pilots, five flight attendants, and 82 passengers. The towing tractor driver, wing-man, and headset-man were not briefed on the pushback maneuver, leading to the nose wheel passing over the headset-man's foot during a turn. The headset-man was injured and subsequently sustaining a fracture on his right tarsometatarsal. The investigation found that the aircraft and towing tractor airworthiness serviceability and communication transmission were not issues. The KNKT has issued safety recommendations to the involved parties.","On May 25, 2019, an Airbus A320 aircraft was operating from Sultan Hasanuddin International Airport to Mopah International Airport. At 1842 UTC, the aircraft began pushback from stand B1 using a towing tractor. The crew, including a towing tractor driver, wing-man, and headset-man, were not briefed on the pushback maneuver. The headset-man, who was wearing a company uniform without a fluorescence strip, walked behind the nose wheel during a turn, causing the aircraft nose wheel to pass over the headset-man's right foot. The investigation found that the aircraft and towing tractor airworthiness serviceability were not issues. The KNKT has been informed of safety actions taken, but there are still safety issues to be considered."
