Sinopsis,Hasil Ringkasan Mesin,Hasil Ringkasan Manusia,Hasil ringkasan Web
"On 29 May 2015, a liberty XL2 aircraft registered PK-LLA was being operated by 
Lombok Institute of Flight Technology (LIFT) on solo touch-and-go circuit
exercises1 at Selaparang Airport, Lombok2
(WADA) and the student pilot was the 
only person on board the aircraft.
Prior the flight, the student pilot was briefed by another student pilot who used the 
PK-LLA aircraft. The other student pilot advised experiencing hard landing however, 
the aircraft condition appeared remain normal. The other student pilot did not 
consider that the hard landing was occurrence that need to be reported. The student 
pilot then conducted preflight check of the aircraft condition and considered that the 
aircraft condition was normal included the nose landing gear.
About 1500 LT (0700 UTC3
), the aircraft departed runway 27 of Lombok with the 
fuel onboard sufficient for three hours flight time, the departure process until the 
third touch and go exercise was uneventful. During landing approach of the fourth 
touch and go, the student pilot used flaps 20Â° with speed about 75 knots. The aircraft 
touched down and continued rolling with the flaps still on 20Â°. When the speed was
about 40 knots, the student pilot felt the nose wheel impacted a patched-runway and 
bounced. The aircraft then touched down harder than usual, to recover the bounce, 
the student pilot increased the engine power and continued to go around. 
At 0740 UTC, the air traffic controller (controller) received information from 
aviation security officer that there was a detached nose wheel on the runway. After 
knowing that the detached nose wheel was from PK-LLA aircraft, the controller
informed the situation to the student pilot and instructed to make holding on left 
downwind runway 27. The controller also coordinated with other related units 
including Aircraft Rescue and Fire Fighting (ARFF) and LIFT representative.
At 0750 UTC, chief flight instructor of LIFT (flight instructor) came to tower and 
communicated with the student pilot to calm down the student pilot. The flight 
instructor instructed to perform a slow flight with flap 30Â° to minimized the aircraft 
speed and to perform low pass over runway 27 for landing gear observation. The 
student pilot performed low pass flying four times over runway 27.
Since the wind direction was from 090Â° until 120Â° with velocity of 8 to 10 knots, the 
flight instructor advised the controller to change the runway in use to runway 09 and 
was approved. The flight instructor then instructed the student pilot to exercise a low 
pass on runway 09. The student pilot performed low pass three times over runway 
09. The flight instructor briefed the student pilot of how to make landing approach in 
such condition and advised to switch off ignition, master switch, and fuel selector 
after landing.","On 29 May 2015, a liberty XL2 aircraft registered PK-LLA was being operated by Lombok Institute of Flight Technology (LIFT) on solo touch-and-go circuitexercises1 at Selaparang Airport, Lombok2(WADA) and the student pilot was the only person on board the aircraft. About 1500 LT (0700 UTC3), the aircraft departed runway 27 of Lombok with the fuel onboard sufficient for three hours flight time, the departure process until the third touch and go exercise was uneventful","On 29 May 2015, a student pilot was the only person on board a Liberty XL2 aircraft operated by Lombok Institute of Flight Technology (LIFT) during solo touch-and-go circuit exercises at Selaparang Airport, Lombok. The student pilot had been briefed by another pilot about a hard landing, but the other pilot did not report it. The student pilot continued to fly until the fourth touch-and-go exercise, when the nose wheel impacted a patched runway and bounced. The air traffic controller informed the student pilot and instructed him to hold on the left downwind runway 27. The flight instructor then instructed the student pilot to perform a low pass over runway 27 and switch to runway 09 due to wind direction.","On May 29, 2015, a student pilot was on a Liberty XL2 aircraft at Selaparang Airport, Lombok, during solo touch-and-go circuit exercises. The student pilot was briefed by another student pilot who reported hard landings, but the aircraft's condition remained normal. The student pilot performed a preflight check and departed runway 27 with fuel onboard. At around 1500 LT, the student pilot experienced a hard landing, but the aircraft regained control and continued to go around. At 0740 UTC, the air traffic controller informed the student pilot of a detached nose wheel on the runway. The controller coordinated with other units, including Aircraft Rescue and Fire Fighting (ARFF) and a LIFT representative. The flight instructor calmed the student pilot and instructed him to perform a slow flight with flap 30° and a low pass over runway 27. The flight instructor advised the controller to change the runway to runway 09 and instructed the student pilot to perform a low pass on runway 09 and switch off ignition, master switch, and fuel selector after landing."
"A Sikorsky S-76C+ helicopter, registration PK-FUP was being operated by PT. Hevilift 
Aviation Indonesia, on 21 March 2015 in day light conducted unscheduled charter flight by 
PT. Total E & P Indonesia. The flight was planned from Sepinggan Airport, Balikpapan to 
Handil helipad than continued flying over Central Processing Unit (CPU) to conduct pipe line 
inspection and return to Sepinggan.
At 0118 UTC, the helicopter departed Sepinggan with destination Handil helipad. On board in 
this flight were eight occupants consisted of two pilots, one engineer, one flight operation 
officer (FOO) and four passengers. The Pilot in Command (PIC) acted as Pilot Flying (PF) 
and Second in Command (SIC) acted as Pilot Monitoring (PM). At 0136 UTC, the helicopter 
landed at Handil helipad and refueled up to approximately 1,600 lbs for the preparation to the 
pipe line inspection flight that was estimated would take 2 hours. The passenger doors on both 
sides of the cabin were removed to ease the inspection. 
At 0205 UTC, the helicopter departed from Handil helipad to CPU. On board this flight were 
seven occupants from Sepinggan consist of two pilots, one flight operation officer (FOO) and 
four passengers, while the engineer stayed at Handil.
After reached the cruising altitude of 1,000 feet the PIC handed over the control to the SIC. 
The SIC engaged the autopilot and flew maintain cruise altitude and speed of 95 knot. The 
weather was clear, wind condition was westerly at speed of 5 knots and visibility 
approximately 8 km. At position approximately 8 Nm from CPU the PIC asked the SIC to 
descend to 600 feet with the rate of 200 feet/minute. While passing 800 feet the helicopter 
attitude became un-commanded. The helicopter rolled to the left and pitch up then rolled to 
the right and pitch down. The SIC lowered the collective and reduced the helicopter speed 
with intention to recover the helicopter attitude with no success. The PIC took over the 
control to recover the helicopter until impacted the tree and crash into swamp. All the 
occupants were survived.
KNKT conducted several tests and research and concluded that the separation of rod end 
bearing from the push rod resulted to the helicopter enters un-commanded attitude.
The investigation determined the contributing factor was the helicopter un-commanded 
attitude caused by loosening of the jam nut on the forward rod end bearing which 
subsequently separated from the push rod, resulted in the un-commanded servo movement.
As result of these accidents FAA issued the Airworthiness Directive related to inspection of 
push rod.
KNKT was informed that safety action had been taken by the operator and considered 
relevant to the occurrence. However, as result of the investigation KNKT issued the 
recommendation to the operator and Sikorsky which is relevant to the safety issue.","At 0136 UTC, the helicopter landed at Handil helipad and refueled up to approximately 1,600 lbs for the preparation to the pipe line inspection flight that was estimated would take 2 hours. The investigation determined the contributing factor was the helicopter un-commanded attitude caused by loosening of the jam nut on the forward rod end bearing which subsequently separated from the push rod, resulted in the un-commanded servo movement","On 21 March 2015, a Sikorsky S-76C+ helicopter was operated by PT. Hevilift Aviation Indonesia, conducting an unscheduled charter flight from Sepinggan Airport to Handil helipad. The flight was intended to conduct pipe line inspection and return to Sepinggan. The helicopter had eight occupants, including two pilots, an engineer, and four passengers. The pilot in command (PIC) and second in command (SIC) acted as Pilot Flying and Pilot Monitoring respectively. The helicopter reached a cruising altitude of 1,000 feet and then crashed into a swamp. The cause of the accident was the separation of the rod end bearing from the push rod, which caused the helicopter to enter an un-commanded attitude. The FAA issued an Airworthiness Directive related to inspecting the push rod. KNKT issued a recommendation to the operator and Sikorsky regarding the safety issue.","On 21 March 2015, a Sikorsky S-76C+ helicopter, registration PK-FUP, was operated by PT. Hevilift Aviation Indonesia. The flight was planned from Sepinggan Airport to Handil helipad, where it was scheduled to conduct pipe line inspection and return to Sepinggan. The helicopter had eight occupants, including two pilots, an engineer, a flight operation officer, and four passengers. At 0136 UTC, the helicopter landed at Handil helipad and refueled for the inspection flight. At 0205 UTC, the helicopter departed from Handil helipad to CPU, with seven occupants from Sepinggan. The helicopter's attitude became un-commanded, causing it to roll to the left and pitch up, then pitch down. The SIC attempted to recover the helicopter but failed, and the PIC took over control. KNKT conducted tests and research, determining that the separation of the rod end bearing from the push rod caused the un-commanded attitude. The FAA issued the Airworthiness Directive related to inspecting the push rod. KNKT informed the operator of safety action, but issued a recommendation to the operator and Sikorsky regarding the safety issue."
"An ATR 72-600, registration PKâ€“GAG, on 03 February 2015, was being operated by PT. 
Garuda Indonesia as a passenger schedule flight with flight number GA7040 from Ngurah 
Ray International Airport of Bali to Lombok International Airport of West Nusa Tenggara. 
The aircraft departed from Ngurah Ray Airport at 09:10 UTC. On board in this flight were 34 
persons cosisting of three pilots, two flights Attendances and 29 passengers. 
The Second in Command (SIC) who was under line training acted as Pilot Flying (PF) and the 
Pilot in Command (PIC) acted as Pilot Monitoring (PM) and the third pilot who occupied the 
cockpit observer seat was also a pilot under line training. 
At 0952 UTC, the aircraft touched down and bounced three times with left wing up and rolled 
to the right about 2Â°. The aircraft travelled out of the runway for about 180 meters and 
stopped at approximate 15 meters on the right side of the runway 13. 
After the aircraft stop, the pilot called several â€œmaydayâ€ to the Lombok Tower controller and 
requested for assistance. The pilot then shut off the engines by activation the engine fire 
handle. The flight attendant contacted the pilot and asked for passenger evacuation, the PIC 
instructed to evacuate the passenger via left door. 
The Lombok Tower controller pressed the crash bell and the Airport Rescue and Fire Fighting 
(ARFF) team arrived few minutes later and assisted the passenger evacuation. No one injure 
on this occurrence. 
The investigation concluded that the contributing factorsto this serious incidents are: 
1. Two transfer of control at critical altitude without clear statement might have made that 
pilots not aware who has the full control of the flight and jeopardize the flight when the 
pilot receive the control not fully aware to the condition of the flight. 
2. The handling of the aircraft after bounce was contrary to the wind condition, and the 
application of the right rudder and cross wind condition might have made the aircraft 
turned to the right. 
Prior to issue this draft final report, the Komite Nasional Keselamatan Transportasi (KNKT) 
has received a Notice to Flight Crew regarding to safety actions taken by the operator 
following this serious incident. 
Following the investigation of this serious incident, Komite Nasional Keselamatan 
Transportasi (KNKT) issued several safety recommendations addressed to PT. Garuda 
Indonesia, Lombok International Airport, and Directorate General of Civil Aviation. 
","The Lombok Tower controller pressed the crash bell and the Airport Rescue and Fire Fighting (ARFF) team arrived few minutes later and assisted the passenger evacuation. Prior to issue this draft final report, the Komite Nasional Keselamatan Transportasi (KNKT) has received a Notice to Flight Crew regarding to safety actions taken by the operator following this serious incident","On February 3, 2015, an ATR 72-600 operated by PT. Garuda Indonesia crashed at Lombok International Airport. The flight had 34 passengers, including three pilots, two flight attendants, and 29 passengers. The aircraft touched down, bounced three times, and rolled to the right about 2°. The pilot called for assistance and shut off the engines. The Lombok Tower controller called for the passenger's evacuation, and the Airport Rescue and Fire Fighting team arrived shortly after. No one was injured. The investigation found that factors contributing to the crash included two transfer of control at critical altitude without clear statement, and the handling of the aircraft contrary to wind conditions. The Komite Nasional Keselamatan Transportasi issued safety recommendations to PT. Garuda Indonesia, Lombok International Airport, and the Directorate General of Civil Aviation.","On February 3, 2015, an ATR 72-600 flight from Ngurah Ray International Airport to Lombok International Airport was operated by PT. Garuda Indonesia. The flight had 34 passengers, including three pilots, two flight attendants, and 29 passengers. The aircraft experienced a three-point bounce and rolled to the right about 2°. The pilot called for assistance and shut off the engines. The Lombok Tower controller pressed the crash bell, and the Airport Rescue and Fire Fighting (ARFF) team arrived shortly after. No one was injured. The investigation found that two transfer of control at critical altitude without clear statement could have made pilots not aware of the flight's condition. The handling of the aircraft after the bounce was contrary to wind conditions, and the application of right rudder and cross wind conditions could have made the aircraft turn to the right. The Komite Nasional Keselamatan Transportasi issued safety recommendations to PT. Garuda Indonesia, Lombok International Airport, and the Directorate General of Civil Aviation."
"On 28 December 2014 an Airbus A320-216 aircraft registered as PK-AXC was cruising at
32,000 feet on a flight from Juanda Airport, Surabaya, Indonesia to Changi Airport,
Singapore with total occupants of 162 persons. The Pilot in Command (PIC) acted as Pilot
Monitoring (PM) and the Second in Command (SIC) acted as Pilot Flying (PF).
The Flight Data Recorder (FDR) recorded that 4 master cautions activated following the
failure of the Rudder Travel Limiter which triggered Electronic Centralized Aircraft
Monitoring (ECAM) message of AUTO FLT RUD TRV LIM SYS. The crew performed the
ECAM procedure on the first three master caution activations. After the 4th master caution,
the FDR recorded different pilot action and the parameters showed similar signature to those
on 25 December 2014 when the FAC CBs were pulled on the ground. This pilot action
resulted on the 5th and 6th master caution activations which correspond respectively to
ECAM message of AUTO FLT FAC 1 FAULT and AUTO FLT FAC 1+2 FAULT
Following two FAC fault, the autopilot and auto-thrust disengaged and the flight control
reverted to Alternate Law which means the aircraft lost several protections available in
Normal Law. The aircraft entered an upset condition and the stall warning activated until the
end of recording.
Participating in the investigation of this accident were Australian ATSB, French BEA,
Singapore AAIB and MOT Malaysia as accredited representatives.","On 28 December 2014 an Airbus A320-216 aircraft registered as PK-AXC was cruising at32,000 feet on a flight from Juanda Airport, Surabaya, Indonesia to Changi Airport,Singapore with total occupants of 162 persons. This pilot actionresulted on the 5th and 6th master caution activations which correspond respectively toECAM message of AUTO FLT FAC 1 FAULT and AUTO FLT FAC 1+2 FAULTFollowing two FAC fault, the autopilot and auto-thrust disengaged and the flight controlreverted to Alternate Law which means the aircraft lost several protections available inNormal Law","On December 28, 2014, an Airbus A320-216 aircraft, registered as PK-AXC, crashed while cruising from Surabaya to Singapore. The pilot in command and second in command were involved in the flight. The Flight Data Recorder recorded four master cautions, which were activated due to the failure of the Rudder Travel Limiter. The autopilot and auto-thrust disengaged, and flight control reverted to Alternate Law, resulting in the aircraft entering an upset condition and activating a stall warning.","On December 28, 2014, an Airbus A320-216 aircraft, registered as PK-AXC, crashed while cruising from Surabaya to Singapore. The pilot in command and second in command were involved in the flight. The Flight Data Recorder recorded four master cautions, which were activated due to the failure of the Rudder Travel Limiter. The autopilot and auto-thrust disengaged, and flight control reverted to Alternate Law, resulting in the aircraft entering an upset condition and activating a stall warning."
"Based on the Komite Nasional Keselamatan Transportasi (KNKT) Policies and Procedures 
Manual, reporting for an accident involving fatality shall be publish in full report. However, 
limited information available for this accident and to prevent several sub-headings with no 
information, KNKT publish the investigation report for this accident in short report format. 
The purpose of the investigation to determine the contributing factor and improve safety is 
maintained. 
A S2R-T34 Thrush (Thrush 510) was being operated by PT. Elang Nusantara Air (ENA) on a 
positioning flight from Batu Ampar, South Kalimantan with intended final destination was 
Cendrawasih Airstrip, Papua. The first flight departed Batu Ampar on 30 November 2014. 
On 1 December 2014, the flight was cancelled due to weather condition. 
On 2 December 2014 the flight continued from Djalaluddin Airport, Gorontalo with intended 
destination Baabulah Airport of Ternate, North Maluku. The flight departed Gorontalo at 
2323 UTC (0723 LT) and was conducted under Visual Flight Rules (VFR) at altitude 7000 
feet. The flight time estimated to be 2 hours 24 minutes and fuel onboard was suitable for 4 
hours and 30 minutes flight time.
At 0138 UTC, the pilot contacted to Manado Approach controller informed that the flight 
was diverted to Sam Ratulangi Airport of Manado. The aircraft position was 62 Nm on radial 
136 from MNO VOR at 8500 feet altitude. 
At 0200 UTC (1000 LT), the Manado Approach controller asked the pilot the position was 
replied by the pilot that position was 17 Nm from MNO VOR.
At 0205 UTC (1005 LT), the Manado Approach controller called the pilot but there was no 
reply. The last position of the aircraft displayed on the Manado Approach controlled radar 
screen was at coordinate 01 20 55 N 125 07 37 E at approximately 2 miles from the nearest 
coast line.
Weather condition on the area of last contact at 0900 - 1100 LT, based on the satellite 
weather image indicated formations of cumulus and cumulonimbus clouds. The satellite 
image indicated that between 0940 to 1010 LT showed rain with intensity moderate to heavy.
The occupants and the main aircraft wreckage were not recovered. Parts recovered were left 
main landing gear, nose and right main wheel tires, outboard part of left elevator and two 
bags. Investigation utilizes all relevant available information.
The contributing factors of this accident was the aircraft entered into unrecoverable condition 
that might caused by pilot disorientation when flying in Instrument Meteorological Condition 
(IMC).
Based on this investigation, KNKT issue recommendation to PT. Elang Nusantara Air and 
DGCA. ","Based on the Komite Nasional Keselamatan Transportasi (KNKT) Policies and Procedures Manual, reporting for an accident involving fatality shall be publish in full report. The last position of the aircraft displayed on the Manado Approach controlled radar screen was at coordinate 01 20 55 N 125 07 37 E at approximately 2 miles from the nearest coast line","The Komite Nasional Keselamatan Transportasi (KNKT) published an investigation report for a fatal accident involving a S2R-T34 Thrush operated by PT. Elang Nusantara Air (ENA). The flight was cancelled due to weather conditions and continued from Djalaluddin Airport to Baabulah Airport. The flight was diverted to Sam Ratulangi Airport, Manado, due to various weather conditions. The occupants and the main aircraft wreckage were not recovered. The investigation found that the aircraft entered an unrecoverable condition, possibly due to pilot disorientation during Instrument Meteorological Condition (IMC). KNKT issued a recommendation to PT. Elang Nusantara Air and DGCA based on the findings. The investigation aims to determine contributing factors and improve safety.","The Komite Nasional Keselamatan Transportasi (KNKT) has published an investigation report for an accident involving a S2R-T34 Thrush (Thrush 510) operated by PT. Elang Nusantara Air (ENA) on a flight from Batu Ampar to Cedarwasih Airstrip, Papua. The flight was cancelled due to weather conditions and continued from Djalaluddin Airport to Baabulah Airport. The aircraft's position was 62 Nm on radial 136 from MNO VOR at 8500 feet altitude. The weather conditions were cumulus and cumulonimbus clouds, with moderate to heavy rain between 0940 and 1010 LT. The occupants and the main aircraft wreckage were not recovered. The contributing factors of the accident were pilot disorientation during Instrument Meteorological Condition (IMC). KNKT issued a recommendation to PT. Elang Nusantara Air and DGCA."
